{
  "schema_version": "1.2",
  "week_start": "2026-08-03",
  "week_end": "2026-08-09",
  "iso_week": "2026-W32",
  "week_label": "2026-08-03 至 08-09",
  "timezone": "Asia/Shanghai",
  "archive_dir": "/Users/moego-winches/Desktop/Company/person/skills/weekly-work-review/tests/fixtures/minimal-valid/2026/08/2026-08-03 至 08-09",
  "archive_shape": "date-range-week-dir",
  "report_path": "2026-08-03 至 08-09 周复盘.md",
  "generated_at": "2026-08-09T00:00:00Z",
  "sources_scanned": {
    "sessions": {
      "status": "not_applicable",
      "tool": "fixture",
      "query": "",
      "artifact_path": "",
      "raw_count": 0,
      "candidate_count": 0,
      "used_count": 0,
      "skipped_reason": "minimal regression fixture"
    },
    "slack_outbound": {
      "status": "not_applicable",
      "tool": "fixture",
      "query": "",
      "artifact_path": "",
      "raw_count": 0,
      "candidate_count": 0,
      "used_count": 0,
      "skipped_reason": "minimal regression fixture"
    },
    "slack_inbound": {
      "status": "not_applicable",
      "tool": "fixture",
      "query": "",
      "artifact_path": "",
      "raw_count": 0,
      "candidate_count": 0,
      "used_count": 0,
      "skipped_reason": "minimal regression fixture"
    },
    "lark_vc": {
      "status": "not_applicable",
      "tool": "fixture",
      "query": "",
      "artifact_path": "",
      "raw_count": 0,
      "candidate_count": 0,
      "used_count": 0,
      "skipped_reason": "minimal regression fixture"
    },
    "lark_calendar": {
      "status": "not_applicable",
      "tool": "fixture",
      "query": "",
      "artifact_path": "",
      "raw_count": 0,
      "candidate_count": 0,
      "used_count": 0,
      "skipped_reason": "minimal regression fixture"
    },
    "lark_minutes_owner": {
      "status": "not_applicable",
      "tool": "fixture",
      "query": "",
      "artifact_path": "",
      "raw_count": 0,
      "candidate_count": 0,
      "used_count": 0,
      "skipped_reason": "minimal regression fixture"
    },
    "lark_minutes_participant": {
      "status": "not_applicable",
      "tool": "fixture",
      "query": "",
      "artifact_path": "",
      "raw_count": 0,
      "candidate_count": 0,
      "used_count": 0,
      "skipped_reason": "minimal regression fixture"
    },
    "shared_clip_link_extraction": {
      "status": "not_applicable",
      "tool": "fixture",
      "query": "",
      "artifact_path": "",
      "raw_count": 0,
      "candidate_count": 0,
      "used_count": 0,
      "skipped_reason": "minimal regression fixture"
    },
    "shared_clip_keyword_search": {
      "status": "not_applicable",
      "tool": "fixture",
      "query": "",
      "artifact_path": "",
      "raw_count": 0,
      "candidate_count": 0,
      "used_count": 0,
      "skipped_reason": "minimal regression fixture"
    },
    "lark_drive_docs": {
      "status": "not_applicable",
      "tool": "fixture",
      "query": "",
      "artifact_path": "",
      "raw_count": 0,
      "candidate_count": 0,
      "used_count": 0,
      "skipped_reason": "minimal regression fixture"
    },
    "local_vault_notes": {
      "status": "not_applicable",
      "tool": "fixture",
      "query": "",
      "artifact_path": "",
      "raw_count": 0,
      "candidate_count": 0,
      "used_count": 0,
      "skipped_reason": "minimal regression fixture"
    },
    "personal_outputs": {
      "status": "not_applicable",
      "tool": "fixture",
      "query": "",
      "artifact_path": "",
      "raw_count": 0,
      "candidate_count": 0,
      "used_count": 0,
      "skipped_reason": "minimal regression fixture"
    },
    "github_activity": {
      "status": "not_applicable",
      "tool": "fixture",
      "query": "",
      "artifact_path": "",
      "raw_count": 0,
      "candidate_count": 0,
      "used_count": 0,
      "skipped_reason": "minimal regression fixture"
    },
    "jira_issues": {
      "status": "not_applicable",
      "tool": "fixture",
      "query": "",
      "artifact_path": "",
      "raw_count": 0,
      "candidate_count": 0,
      "used_count": 0,
      "skipped_reason": "minimal regression fixture"
    },
    "jira_worklog": {
      "status": "not_applicable",
      "tool": "fixture",
      "query": "",
      "artifact_path": "",
      "raw_count": 0,
      "candidate_count": 0,
      "used_count": 0,
      "skipped_reason": "minimal regression fixture"
    }
  },
  "queries_run": [],
  "empty_results": [],
  "candidate_items": [],
  "output_items": [],
  "indexed_items": [],
  "used_in_report": [],
  "excluded_with_reason": [],
  "coverage_summary": {
    "total_candidates": 0,
    "total_used": 0,
    "total_outputs": 0,
    "outputs_in_report": 0,
    "output_coverage_ratio": 1,
    "high_signal_candidates": 0,
    "high_signal_used": 0,
    "high_signal_usage_ratio": 0,
    "shared_clip_candidates": 0,
    "shared_clip_indexed": 0,
    "sources_missing": [],
    "low_usage_explanation": "minimal regression fixture has no real evidence",
    "session_agents": {}
  }
}
